Comment,Author,Comment ID,Like Count
im crying this is so gooood,@kidsamurai7662,UgyUXij1TNT8zt62t6N4AaABAg,0
it should of been him who dieed it should of been anyone else.,@Riplatki,UgxIwcmUSlqtBeNulQh4AaABAg,0
"Making me cry, this is so beautiful.",@wroman2029,Ugz0Hw7dwuftH9x8KeB4AaABAg,0
Some how Technoblade is more remembered than the queen of England what a legend he surely left a huge mark before passing away.. :),@Bluedd6750,UgwMkvlBsaei7HQ92dB4AaABAg,0
"this is amazing, techno would be proud",@IdealNeptune7,UgxsCg1VuPClIKanXex4AaABAg,0
I CANT BELIEVE THIS ACTUALLY MADE ME CRY OMG THIS IS SO AMAZING!!!,@IAmReallyBadAtNames,Ugzuk9iQbYRzYGxMO5F4AaABAg,0
A chill of happiness went down my spine at the end where the quote happened 😊,@catmungo4500,UgylDy_TP7icFsd0WvN4AaABAg,0
this made me cry and i audibly gasped when i heard the start to blitz. it's on my playlist so i hear it everyday :),@ov3rwrld499,Ugxki1BdmUnFTOYfu3t4AaABAg,0
#technobladeneverdies,@nuclearbomb5590,UgzAQmZs50Ti58PuDQJ4AaABAg,0
Absolutely in love with this,@zoeleistikow6965,UgzC59KmO0jy2YnQgth4AaABAg,0
"I LOVE YOU TECHNO AND ILL ALWAYS LOVE YOU, YOU’LL ALWAYS BE ALIVE IN MY MEMORIES FOR AS LONG AS I LIVE YOU WERE A GIFT TO ME, YOU WERE THE JOY AND COLOR IN MY GREY WORLD I PRAY YOU’RE IN PEACE AWAY FROM HURT AND PAIN. 🐽❤️‍🔥 TECHNOBLADE NEVER DIES‼️‼️",@angerukurudesuka,UgwMHPlwTl7reQdMl_t4AaABAg,0
Aaaaand I'm crying,@henriquemorales212,Ugz8jC3ZKt2TMpwMqtx4AaABAg,0
It's nice he hasn't been forgotten,@catmungo4500,UgxA3GNS-gmfMJ7IxYl4AaABAg,0
Rest in peace you actual f****** legend Technoblade never dies,@harry-hr5429,UgzgW8JOSIyP27AdEu94AaABAg,0
It's been almost a year and I still can't get over the fact he's gone.,@Chees3it,UgzzvISE6AgNelwM8EN4AaABAg,0
a little late for a tribute but well fucking done,@werewolf6596,UgxqIggdIMIgE0OR_Y14AaABAg,0
I. Just. Thanks.,@Orange_Tree_,UgyaLpq9KQ0lHrOlYop4AaABAg,0
Possibly the best animation of Techno I've seen on this platform,@maximoxer7760,UgzEJ4MOHkXBXuRSme54AaABAg,0
I'm not crying you're crying,@gabrielreyescastano2544,Ugyd1-_DcQCzA-72Irt4AaABAg,1
"so many memorise in one vid, trully amazing 
thank you for this video
and the legend may he rest in peace",@potatolegacy,UgwbqDjXTxEaZy-3aYN4AaABAg,0
He conquered the kingdom of god now... TECHNOBLADE NEVER DIES!,@carolynbeard9370,Ugzjv4JIxy9h7KfZ3f14AaABAg,0
i cryied while watching this it brings back the memories,@kubastyczen258,Ugw9LFa_VxLoSlDjGKJ4AaABAg,0
May this legend's legacy continue till the end of time.,@danicboi7548,UgwoDuEpyHYNSiuZx4Z4AaABAg,1
"I’m glad i stopped putting this off and finally watched it, it was beautiful ❤️",@puriennee5871,Ugx2yZNtcXgYKDk0lNx4AaABAg,0
"Technoblade will be dearly missed by the entire Minecraft community and be remembered as a legend.
Technoblade never dies!",@teardrop027,UgzA8PCrbOpUWiDaQO14AaABAg,0
Techno was a great guy and he wouldn't want us to be sad about his death but happy about his life and the great moments if heaven exists we all know he is watching down on us. I wonder if in years all the money he raised and is raising in these videos will actually defeat cancer it truly shows that even if you are gone you still impact the world. TECHNOBLADE NEVER DIES!!!!!!!!!!!!,@afewglorifiedgeodes,UgyWZt1_yHx_XyGzmFl4AaABAg,132
So sad he’s gone. The saddest part was that he was so close to amputating and maybe surviving.,@clownie5991,UgzO6ye_69IVXwiVJ3N4AaABAg,2
nice,@gregoryspanenburg7875,UgxHdUgx7yucLyd8gfp4AaABAg,0
Keep it up!!!! Keep his legacy alive,@LakshayKaushik-tt2pf,Ugx4HcuyCATrldLF3wF4AaABAg,0
Amazing bro,@herrahreinn,UgwWAJCJB7GZghRr3pJ4AaABAg,1
Hehe I wonder what hes plannin up their. He left a void in our hearts. But he left a mighty big legacy behind and a bright future for others to follow. Rest easy king.,@likedrop165,UgxeJuRtWy8jarYVRvx4AaABAg,0
"A lovely tribute, thank you, made me cry at the end.",@PJ92586,UgwhF8YHFwIWMK-GPBp4AaABAg,0
one of us o7,@Cannibalsandwichnew,UgwLmRRpUSChfhWdaNN4AaABAg,0
I just have to say techno is always gonna be there even if he’s gone now techno is the legend forever in our hearts ❤️ rest good Alex you’ve earned it king❤️,@ney10_willie_footy,Ugy5CdRX7iDcvtj4ftZ4AaABAg,2
"I don’t have fancy or elegant words to convey how much I enjoyed and appreciated this, so just, thank you",@haydendiviney1691,Ugy9dXHirtIMQlreD-94AaABAg,1
THE PIG OF GLORY,@nega621,UgwiLrQTxksuzkVJ7nl4AaABAg,0
"this is so so beautiful, thank you for this incredible tribute 🥺",@aquadust,UgzqWj1OqdpFulNxywV4AaABAg,1
"wow, i love the song and animation so much. it brings me nostalgia just to watch this once, and it really does add all those amazing memories of technoblade. Technoblade never dies!",@XNgaming01,UgzIGowWN20LtzIlV7R4AaABAg,0
"Salute to you, Techno.",@Canada_Gaming,Ugx1UdGcSCg_vFvbudV4AaABAg,0
"The Thought that hits u when ur watching technoblade videos or clips that this guy is dead and there will be no more of him is really depressing... 
RIP technoblade such a legend.",@Lapizlz,UgzOdNPkSyxjNL6yakd4AaABAg,0
Only real techno fans would get all the edits R.I.P Legend,@zysstyt4684,Ugy5Z6RADWqV2VYECG54AaABAg,1
TECHNOBLADE NEVER DIES!,@slashezi,Ugzv_RlTMJqZI-I3Nt94AaABAg,1
I'm not crying! just something got into my eye!,@DillerwithI,UgwarEF-87emoNV2y8R4AaABAg,1
thechnoblade is alive in our hearts he would have loved this tribute:(,@DeborahRukundo,UgxRd5aAWjlWNN3YMod4AaABAg,0
Oh my gawsh this is amazing❤❤❤❤❤,@zeelovescoffee,UgyPcJXUnprJqcQdjhR4AaABAg,0
I got goosebumps,@safiyyka,UgyYHmzI5Qqp68MqXvp4AaABAg,0
This is amazing 🤩,@enderknightzane8010,UgzlPxrxR0Yxkw4bkat4AaABAg,0
Beautiful...just beautiful 🥹🐷👑⚔️,@paranoidpumpkin98,Ugzq23twvx6SBqjscVx4AaABAg,0
Forever the king of minecraft,@dianelatonio9665,UgzJqKSQNq-TEjB2XoZ4AaABAg,0
"this made me smile so hard, thanks for making my day immediately 100 times better ❤",@Aurosaurus,UgwPBo_0ZNMAlbNUhaF4AaABAg,0
THAT BLITZ MUSIC AT THE END OF THE MUSIC IS WHAT GOT ME 😭😭😭,@FlittaLink,UgxR8-TZCn8G_qktbuN4AaABAg,0
"It's too early in the morning rn for all these emotions wth 😭
Beautiful video and amazing work",@boldragarcia1062,Ugw-dxZxQ6tQBXa54CF4AaABAg,0
#technobladeneverdie he is still the king we know,@alannahardesty6166,UgxRLDQ65m0-iVVm_Gh4AaABAg,0
I was smiling throughout the entire video until i heard his voice. why must you make us cry in this manner?,@obsxssed,UgwC2DmFw-U3g8GD-0N4AaABAg,0
We morn for a legend we will see u in Valhalla,@Designer-kf3dt,UgwR-1v7uNJ9mudSzoh4AaABAg,0
teno nerver  dias,@geisterkopf7955,Ugz6oD0XNcPeL42jSQZ4AaABAg,0
may you be blessed,@shad0wblazer220,Ugyc69kIRT1wo3qbM1d4AaABAg,0
"I’m still shocked it’s been almost a year,
Even more shocked that there is so many people who still remember him. Not that I’m sad about it, I’m actually very happy about it.
:D",@n_kau,UgwJgE39pqTovQ0LPqZ4AaABAg,0
TechnoBlade Never Dies!,@MrTaskmaster1,UgwDqk8Zjc8SXkudifF4AaABAg,0
"What a wonderful trip trough memory lane, this just made my day so much better",@Puppenjunge,UgxKdgBeJ2y-QfYsG3h4AaABAg,0
I love this.,@IZO_9,UgyTG5L4JB3jKrW4U9R4AaABAg,0
god i gonna die knowing that there will be a generation of people who don't know who Technoblade is. Rest in peace king.,@YourAverageSinner,UgxbguA23iEBms4Vi954AaABAg,0
101: HOW TO CRY,@The_Random_nugget,UgxUxgxFdzYOe8C_dYV4AaABAg,0
"Long live the king
Fly high Technoblade",@Mylenapony,Ugxgs7VU9WCX8Sy_EaZ4AaABAg,0
"It's always amazing to see people carrying on Technos legacy through art. 
TechnoBlade Never Dies babyyyyyyy",@iternitygoesbrrr1580,UgzJcNA8SB3O_8BcLyV4AaABAg,0
Thank you for this,@TacoShade,Ugyzc_Qqc4iQpKV-0ol4AaABAg,1
"“One day, we will look back at where we started and be amazed by how far we’ve come.”

“Technoblade never dies.”",@fluffyenderkitsune6565,UgzvnNO3ThWgmv9OuHF4AaABAg,5
"nooo stop this brought me to tears.
I loved this so much,
Technoblade Never Dies o7",@Lena-bp2py,Ugzz8B7icqv-C6W-FZh4AaABAg,0
;-; very well done,@socks2337,UgwAobfo5rgvpclu57t4AaABAg,0
This is so sweet I love this tribute! Thank you for making this and R.I.P. Technoblade.,@katestephenson8008,UgyMahqA8Xg5qhkB1td4AaABAg,0
amazing,@MinoTaurusLoL,UgwKT9NkIUMQls0UYPB4AaABAg,0
Almost a year since his death and I still cry when I think of it. This song is a good fit,@lifeispointless7627,UgxskN3aTIf8M5GTDHB4AaABAg,0
I can't stop crying 😭 thanks technoblade,@claxl4036,Ugyj-VfGB6KWZhHHtIh4AaABAg,0
"Damn this actually made eme tear up, such an amazing tribute, thank you you for making such a great piece of work!",@angel5s645,UgyI5A1aSaoaXMfxTzF4AaABAg,1
I'm not crying! My eyes are just sweaty!,@blackhat4257,Ugz3Rhe5XmR-jYZCc6V4AaABAg,0
"R.i.p techno, you will live on in our hearts ❤",@PugzTheArtist,UgzWnhTHTPBDPR4qGKl4AaABAg,0
"Till this day he is still remembered, rest in peace my childhood he has changed my outlook on life alot with his snarkiness and sarcastic remarks that are hilarious I'm a growing up and I will eventually forget this time but for what its worth I'm happy to be one of his Fan's",@jaggyd2862,UgwVbHP70OSZt283s0p4AaABAg,0
niuce tribute but most coments are robot,@monir7369,UgxSQapY-y5J63300714AaABAg,0
its been so long and i still cant get thru this vid without crying...,@mechanicer3105,UgwAtOHpT2rD3DPhi0h4AaABAg,0
I miss him he was my favorite,@kaptianshadow7336,Ugw0w-SC9SPUSr1jOSF4AaABAg,0
🔔🔔🔔One of Us🔔🔔🔔,@qahnaarin8335,Ugz_G0Du75rhjeiFr2x4AaABAg,1
"IM NOT CRYING YOU ARE!! ARGHHHHHHHHHHHH WHY DID HE HAVE TO DIE😭😭😭😭😭 also. Fuck yt. Why are you giving me a survey when I’m TRYNNA WATCH SMTHING SAD?! AND UR STUIPED HAPPY MUSIC?! Buh Buh Buh….Buh Buh bu- LIKE SHUT UP. anyway- I miss you techno, can’t wait to see you in hell❤",@-Ashy.Pawz-,UgzhwpR0d5WmlPhvWDd4AaABAg,0
I loved the Jojo pose for the potato war XD,@Chaosgremlin69420,UgwBpTEj4ZfuPhvgadl4AaABAg,1
Man out here making me emotionall!!!,@doxplaysgames572,UgypdBnh_RDEgnbE5tV4AaABAg,0
"thank you, i miss him so much",@poesero,Ugyyneu5zP-iQbj9E6V4AaABAg,0
Shall the legend rest in peace. He's probably doing what he loves up in the land of bright white clouds.,@wessneed2784,UgyB0Ksdy3vF7TI8-6l4AaABAg,3
I remember this legend......,@crooftplaysz1124,UgweLpARAHEzLyoGgkJ4AaABAg,0
love the fact that u added the autoclicker video,@Coolmansam696,Ugwza_imHciHXf3ikRZ4AaABAg,0
My words fail me. This is unbelievably great. Every part of it.,@eternalmec3777,UgwfojkelBfWNPs9yep4AaABAg,0
"this is amazing, This made me cry
I love technoblade so much, his humor, His personality and his streams. He was legend and still is, I 'm glad I stumble him upon in my fyp in youtube, I'm so thankful for him for making me smile whenever he does his streams and he's funny moments that didn't fail to make me laugh , This video is the best <3
I miss him, everyone does. I hope he lives the best of life in heaven :) 

Technoblade never dies, He will be forever in our hearts",@lovable_dork9797,UgwMaP4yZoN8HVvxgkJ4AaABAg,0
I'm trying to hold in my tears rn my guy tysm for making this for our epic legend!,@JustCallMeCz,UgyTK422rgfDBdID-8N4AaABAg,0
"got chills through the video
RIP the legend Technoblade",@Thisissoren,Ugw97p8Kqt0iuB5zXA54AaABAg,0
I miss Technoblade still. Was sad that so many used his passing to get clicks and stuff as soon as they heard. But i like that you waited a good while to put your own tribute to him.,@sanstheskeleton7386,Ugz5D87c5lHzNkQE6f54AaABAg,0
"This filled me with joy and made me kinda sad but mostly happy
Its still hard to process that he is dead
Technoblade never dies",@amitakler4710,UgyOV5yvwdkxxUkZxyJ4AaABAg,0
"This put a smile on my face. It's been so long, but he will be a legend forever. 
Y'know, we should make a techno religion.",@cookieepasel2406,Ugx83oKQD4z-mxJxdqF4AaABAg,0
"The legend will never die

Rest in peace Technoblabe. You deserve it",@Orochiex3,UgzW0qAFYDb67Tz1oMB4AaABAg,0
beautiful,@OdinTheDodin,UgypaAwpBedFYM2mvb94AaABAg,0
"Even though I'm not a Minecraft fan, I can tell how much he's brought to the community and how sweet and badass of a person he is. 

May you rule the heavens, Technoblade",@Ghost-ce9tw,UgxnE84GIc6Vp_pBF9V4AaABAg,266
"😭😭😭😭😭😭😭😭😭
Technoblade never dies, but rest in peace you legend",@NordicKitt,UgyeuC4UjgF5ZGtixCV4AaABAg,0
"Thank you Technoblade, for all you’ve done.",@TayNoTaisho,UgxZbhiJ8F_ayHCC7_14AaABAg,1
"Everyone say it with me on 3
1, 2, 3, SCREW CANCER",@rileyf1178,UgxZZewn8SIr-dVfk4B4AaABAg,0
that was beautiful. made me cry a little lol. rip techno!,@iris-x6j,Ugzhv2ImwggHccvcKrB4AaABAg,0
"My god, I teared up a little. Fuck, this has my heart.

It strikes me now that even though he was a man behind a screen, a man behind a piggy mask, he reached our hearts beyond how real life people could.

You could bond with people all because you were apart of his community.

So many people survived depression because of him. So many people saw him as a comfort streamer. They saw comfort where they couldn’t find it anywhere else, not even from their alive parents. He reached our hearts when he wasn’t even here with us. It just shows how much the world needed him.

Many people say how they’re thankful that not everyone has forgotten him. The thing is, no one will ever forget. Even if you hated him, even if you never watched him, many people know that he was a legend, defying Minecraft’s supposed way of playing when he played with a wheel, or winning a whole potato war just for the fun of it. He pvp’ed like no other, making hundreds, thousands, even millions smile all at once.

Technoblade lives on, in our hearts, minds, and spirits.

Technoblade will not die as long as the community keeps him alive.

Technoblade never dies.",@Daytime_Scars,UgxHiRZd7ZtzYdvej4R4AaABAg,882
respect to this man. let there be blood for the blood god.😞👌 p.s.im literaly crying right now,@pessiebernstein5923,Ugw1CNkjS88JOOpZO9d4AaABAg,0
"It's beutiful. Long Live Technoblade. The Freind, the Hero, the Human.",@mello_jelloh3llo,Ugy6zcvLcgLpfs26nfZ4AaABAg,0
This is amazing Im so happy people are still making contributions to him. (I have happy and sad tears forming in my eyes Its beautiful.),@Thelonely.person,UgyEMFNorBN6wNgZRpl4AaABAg,1
My HEaRt!!!!,@katypeterman794,UgwOxvCth9uD7t7UB714AaABAg,0
BLOOD FOR THE BLOOD GODS 🩸🩸🩸🩸🩸🩸🩸🩸⚔⚔,@tom_a_tree_is_like_a_bee_w4297,UgzEaplXeiglWNawSyh4AaABAg,0
"I was very new to the dsmp when techno passed away,he was actually the reason I was starting to learn about it so I was very sad when he died but this animation was beautiful great job:)",@-The_Silliest_Goblin-,UgyMMmeKIqbPF2Q7Njx4AaABAg,0
I still can’t believe he’s gone.. I miss him…I hope he’s happy and gets reborn..,@Aceythemoth,UgySDvyqzVENdJtSq3F4AaABAg,1
"Rest in peace Technoblade, you have earned many hearts from the beginning ever since. Glory to the blood god.",@MeiLikesToDraw,Ugz-qYt61uoVSvc8GNp4AaABAg,16
"Since this might blow up, I'll just leave a comment here just in case :D",@TenebresLikesToObserve,UgzrFW7Zxh1PW87SMmV4AaABAg,0
"His memory was never forgotten.
His trace lives on.
The community lives on.
The legend lives on.
The memories lives on.
Technoblade, Lives on.
Technoblade never dies.",@gravity_fans5087,UgwGXX6hL03oiV_cJvx4AaABAg,1
"I love this, I've made it a commitment to always wear pink on his anniversary, thank you for your contribution to this community ❤",@lovelessdanny,UgzFleDYpipILvljv8p4AaABAg,0
I'm so glad that people still remember him and making videos about him. It pleases my eye so much!❤ He will forever be alive in my heart,@fluffydog4795,UgyP0_eI2a5f_8qHF1h4AaABAg,42
I miss him so much,@GladHeAteHer_,UgyeLlaO0ilb6C8sT4J4AaABAg,0
"I love how this tribute doesn’t focus on his largest moments too much. Most tributes focus on the dream smp, or Minecraft mondays, or the potato war, or the bedwars win streak. This one has all of those, plus his click speed video, the earth smp, and many others. It truly feels like a retelling of technoblade",@dustypaladin9216,UgyEssdn8vdU33ozxT14AaABAg,40
"O7, I wish techno could see this masterpiece",@4nevar,UgzkmRLxI6ySGa3EXkl4AaABAg,0
Owch,@foguinho_bravo8205,Ugzv4_km_wz4tv5sJkJ4AaABAg,0
🕊🎗,@chickenchicken777,UgzsCatGpOCEkVIK9vt4AaABAg,0
"This hurts me (in a good way, not like it was bad, it was the opposite, I loved watching this video, the thing is that it will be 1 FULL year from his passing away and still, I didnt get trought it",@neopavel,UgxHK8u1IH4aQjOTLjl4AaABAg,0
Beautiful.,@berensloan5819,UgwCVa9Vl8jth9IQVYd4AaABAg,1
"Got reminded about him today
I want to cri",@baotan774,UgyFmroc-ynyvv5K5-Z4AaABAg,0
Moment of science for our hero 🫡 fly high. technoblade never dies,@Peteb804,UgyiW1eibuKFndBFR_t4AaABAg,0
Omg the words he said at the end when he put up his crown cape and sword made me cry 😢,@Rayneph0b1a,UgxwU-v9m9FBWJhuxDF4AaABAg,0
Exactly at the last 3 seconds of the video I burst in tears from the reminder of the dead what it did to people I know and technoblade ❤,@lucaasen,UgzEoqm4OqoX9eU2_0h4AaABAg,1
"ive been avoiding watching this, cuz these usually make me really sad, but after it popped up in my recommended for the 15th time i figured id give it a watch and it was really awesome! i love that it was so upbeat and that it highlighted how amazing and inspirational he was to all of us! thank you for this beautiful piece of art :)",@forkmanmiek5817,UgzeTCenfXQBKyju6Rx4AaABAg,6
he was an inspiration to millions of people no matter how old no matter how young.....he will always be rembered as the bloodgod within our ranks. He went out like a true warrior,@alexmason25593,UgxOAhnAEpwCcXyDYa54AaABAg,6
o7,@ninjahaz0180,UgzevibZVHld2R4Q22F4AaABAg,0
"i legit cryed , daam that was well done",@DarkElectravire,Ugxo0uRmY970dWbqLnp4AaABAg,0
Technoblade is the true king of Minecraft!,@nikolaq5248,Ugypd0EZJP2LH4wLYSR4AaABAg,0
"I never knew about him until he died 
I was confused at the time on who he was but I saw a lot of people seem to like him and I feel like I missed something special or something 
Even so 
I hope he's resting in peace wherever his soul has left to 🕊",@theplayer5567,Ugy-GFIbkDI9fIXVvsl4AaABAg,0
i love it tnx u for making it made my day,@gvolleberg5143,UgzWJY2vsRq1pXFLANB4AaABAg,0
god damn it im not crying someone's chopping onions 'long live the blood god',@itz_nova13,Ugy4OBe-L7pqSe3WqB94AaABAg,0
I love the nods to the elbow reveal lmao,@Lupikus,UgwdZw5MDSX5891Zwl14AaABAg,0
Technoblade never dies.,@LunrFox,UgzUfMSd5-mdGPA34P14AaABAg,1
@MrTechnodad,@godgaming4334,Ugwy7afLjiEnKk5KsUN4AaABAg,0
"Next-generation: who's technoblade?

Us: now, why don't you sit down, so-",@PG9_,UgwhZoGT6LV8WQkrFzF4AaABAg,0
TECHNOBLADE NEVER DIES!!!!,@godgaming4334,UgxKTij2hXvIYOTUS9B4AaABAg,0
Wow,@HunterEastman07,UgweriU4p6fb1iJrbTZ4AaABAg,0
literal chills this is the first Technoblade related content that Ive actually been able to consume in the time since he has passed. thank you for this beautiful video.,@juliesdream2001,UgyseXz9WvZQn3ui41t4AaABAg,0
"I don't have the heart to read the comments because of how much they remind me of him
We will always rememer you technoblade ❤❤",@DarkLord-01113,UgzfT0ohsmtaMi5tV2R4AaABAg,0
"Throughout human history, we have searched for immortality, to slay death. However, as even the ancient Mesopotamians knew, immortality is rather achieved by leaving a legacy that would let no one forget who you were and what you did. As long as we remember the blade and what he did, he will never die. Techno blade will never die, as long as we remember him",@steakmaster4897,UgyDfahxhABNuzvgPaF4AaABAg,0
"Still hits me in guts seeing his crown, sword and cape being left behind by him",@hyp3rblade,Ugz7q0OExBIs6f-33hJ4AaABAg,0
O7,@Qo0_0,Ugyj9AmE7lXXC6aiGNh4AaABAg,0
Technoblade never dies,@cedricjones7418,UgzNIAo31zT9hRcttnB4AaABAg,0
"Oh man this gave me chills.The fire of life, those whom shine twice as bright die twice as fast. - Old Chinese saying.",@jackzhangkarlsson7781,Ugy42-F9Bewiuovrc8d4AaABAg,0
i know this going to to make me cry but not like this hahah. :'D,@bryllbotardo5749,UgxiLWA8d1enyKBr8f54AaABAg,0
❤🐷👑,@redp9116,UgzV3kXLKvfabfU31th4AaABAg,0
I love it,@peaterpizza5891,UgwmM-OY5aXGsS8fmmF4AaABAg,0
Let’s all take a moment of silence to remember technoblade,@jakebardgett6755,UgzfAc_L-t6lumlzqSh4AaABAg,0
Of all the techno tributes this is one of my favorites great job!,@Bwubdle198,Ugy01L-nUIV3JUEWGUd4AaABAg,0
"Im only human, after all.",@ferna8397A,UgwjqQrcNXRzwOsGZLZ4AaABAg,0
This tribute is beautiful I loved watching every moment of it thank you for making my day as a Technoblade fan,@zeewars6851,UgxWWHJy-Yg3OVyjHeR4AaABAg,0
i don't normally comment but this was amazing really well done,@ollieeaton4640,Ugxk6duNY6fLJRxeaRp4AaABAg,0
"I remember watching every mcc that techno was in it was really nice to see this and realize he will always be with us and will never die like his famous quote
“Techno blade never dies”",@ihess9291,UgwGGGd-R5PF9LTNagx4AaABAg,0
A king pig with urahara,@Mugiwada,UgxxySWmscepebwQ-wt4AaABAg,1
this made my day! Techno's community is so incredibly talented and I'm so proud to be a part of it,@BitterPotato,UgzPVJJTHCsxzE5YRKx4AaABAg,0
I still miss him,@ggwp9478,UgxlsUVxfHU6xQBfzhd4AaABAg,0
all of the moments we had along side techno o7,@Captain_Purple52,UgyUE4j8Ui00kem0oVN4AaABAg,0
Can’t believe it’s been a full year since Techno and people are still making stuff like this. WAAAH WAAAH everyone dies get over it people.,@ChaosWizardZai,UgwYqmFtqJKfTU02cWV4AaABAg,0
"I wish I could do something like this, rest in peace Techno, you will never be forgotten",@wingerwc,UgyusqGE2XfS506TNQ14AaABAg,4
earned a new subbie !!,@foshelios,Ugz3-dYGZvq-PDSda354AaABAg,0
almost a year later and there are still these tributes. rip techno🕊,@thecoolacactus7898,Ugz4JZGx47unEbzxF3V4AaABAg,1
This is easily one of the best tributes I have seen.,@jamesfries5647,UgzDl-DaCPS21FcSeMp4AaABAg,1
"Such a beautiful tribute. This wound will never truly heal, but that’s ok. Funny as it sounds the pain reminds me of the good he did, and I never want that to fade",@MothFable,UgwmVmtzbSVghyEGBJ94AaABAg,2
At first I thought we'd never be able to survive without him but... He's still with us. Techno will thrive in our memories for ever more. I will miss him dearly.,@ork5419,UgyumSb5jGY9i2D0SgB4AaABAg,4
Every detail in this video bring tears to my eyes.🥲,@AlperFKoc,Ugy9wXNUc2hzepufkT94AaABAg,1
Holy hekk,@orangeplains,UgxzWybamaP8MjY_ydh4AaABAg,0
Long live the legend! TECHNO NEVER DIES!!!!!!!!!!!!!!!!!!,@owenjefferies416,UgwnlCoI_Elw2WjMtb14AaABAg,0
👑,@cyno6333,Ugyj_E16XJYnemxlk6N4AaABAg,0
"Amazing tribute that put a smile on my face!
Fly High King! o7",@shuyuyummy3924,UgwlfsdlLOOCZyJOCr94AaABAg,0
A true legend will never die,@KFCLoversWOOOOOO,UgyF397Z9UQMHrpD6894AaABAg,0
TRCHNOBLADE NEVER DIE’SSSSSSS,@roofmolly8312,UgxBCFNs-Pj7cH4Be8F4AaABAg,1
bro he died like a year ago how much u guna milk this 💀,@Yudayaa,Ugy3Zf86HL3EdnSfwj94AaABAg,1
😭❤,@DerpNugget4,UgwlEIS9utbOQmYh20l4AaABAg,0
havent cried this good or this much in a while. thank you,@clara.p,Ugy_usFoBXQ_o1dCi2B4AaABAg,0
Techo was the best minecraft Toutuber!,@Rainsonchen,UgzpomdhyuDh5HXwK014AaABAg,1
One of the best tributes! Fly high Techno 🕊️,@oIceicle,UgzmlcoUSZAiKk7A3_V4AaABAg,1
TECHNOBLADE NEVER DIES,@exist8294,UgyrX7zaJItPmgqauWl4AaABAg,0
that ending. that fucking ending.,@afpnia1068,Ugzgyzxq0MXX1LSqxZV4AaABAg,0
If Alex left me with anything its that there's a little bit of Technoblade in all of us. Thank you Alex. <3 🥔,@esmeraytv,Ugw3jnPw0gM5vIKYh_t4AaABAg,0
Thank you so much for this. You made me cry again hahahaha,@sawlaen824,UgzKaFju6Vjzmaek05p4AaABAg,1
"It's actually been 1 year? Time really flies.
R.I.P techno, you will never be forgotten.
✨👑✨",@-Pyro_Maniac-,Ugz7L4uA1jhzI5a3dKx4AaABAg,1
"07
07 chain v",@menace4770,UgxdCNOiRIUoJ4rhR-94AaABAg,1
o7,@ShotgunLover2367,UgyieSKZb02bOvfDyLV4AaABAg,0
o7,@ShotgunLover2367,Ugy97XILRA5LlDnf3ip4AaABAg,0
o7,@ShotgunLover2367,UgzFLRFg2Y5rTPSMSNR4AaABAg,0
Spam this comment section with o7,@ShotgunLover2367,UgySz75HN1b7uaFfkC14AaABAg,1
It is an amazing tribute and you can tell love was put into this work,@nohan8559,UgwRbGwQL387ITrUEY14AaABAg,1
its a terrible day for rain...,@ThePencilOfChewed,UgxqQeaEDOnMrdlD4jF4AaABAg,0
This was such a beautiful tribute and I'm sure techno would have loved it too.,@_Sailor_Moon_1,UgwFOUYd1Gt7B_D4hjx4AaABAg,69
whats the song,@tubb3r,Ugwh76mgh7yWHY93WOJ4AaABAg,0
"my comfort song and my comfort YouTuber? Fuck dude good god don't make me cry i'm in class rn

Update i teared up a bit lmao and then a small smile appeared at the outro:)",@kristinexqz,UgyP5eYguOpzkiaACL54AaABAg,0
"I loved how the animation showed Technoblade more than just his persona. I feel like (no offense to the animators), that we only see Technoblade through his persona.
Thank you for this wonderful animation <3 /p",@pine_is_tired,UgyqLqQxxSRXOxBl0Dp4AaABAg,0
☺,@RiandreDelaCruz-xr4of,Ugy064gTCBJS1MWReoN4AaABAg,0
I still can't help but cry everytime I hear his voice.,@AdlerVision,UgxSX1hzHDlCp3bGmHh4AaABAg,1
Rip 😊🙂😐😞😣😟😢😫😢😢😢😢😢😢😢😢😭😭😭😭😭😭😭😭😭😭😭😭😭😭😭😭😭😭😭 ill put your inventory in a chest for you to return to * KING 🐷👑 rest in items * chat - technoblade  was slan by π¥£¢€¶,@amandabrawley2872,UgwxkqoPnZNKlGImeMF4AaABAg,0
techno is one of the best people I've ever came across in my life,@MettoMinecraft,Ugzx4hk6rp4nAK7pohZ4AaABAg,0
"Don't cry because he died, smile because he left us a message to fight cancer 💖💖💖",@Blue-ooo0000,UgwzJyoBwnrDgv7rj5Z4AaABAg,0
IM NOT CRYING YOUR CRYING,@dreamkiller343,UgxQBeyJ89tDDuhnu4l4AaABAg,0
