Comment,Author,Comment ID,Like Count
alex maby past away but techno will always be alive in our hearts RIP,@justvalentino12341,UgwBxwhZr8EEzvpJ4lB4AaABAg,1
"he maby past away but he never will be forgotten and wil always be remember as the legend he. is
and be alive in our harts RIP",@justvalentino12341,UgzNtyVhqqYm-8yPptt4AaABAg,1
Technoblade never dies,@Biddi394,UgxKpspO53kQWZmG_bV4AaABAg,0
"It’s now been a year since he died, this is a beautiful animation for him",@OnlyChaosCanAnimate,Ugx5piVjulXHEm3mZjB4AaABAg,0
WE ALL MISS YOU TECHNOBLADE 😭,@goofy318,UgyOV6UQnFdYy8WzMsJ4AaABAg,0
Beautiful,@Traxityyy,UgwH0S3QLTbeu6ZO_hh4AaABAg,0
Technoblade never dies,@easterndrip5180,UgwsOjDDfZGdQ77aLqN4AaABAg,0
This was amazing. Amazing at making me sob like crazy that is. Jokes aside thank you for this beautiful video,@SaffronRice,UgwsYIdfk-kMxyqxwR54AaABAg,1
fuck man...,@liamvey3024,UgzUSRyS2nDP2njUEsF4AaABAg,0
Technoblade never dies always remember that,@johnmartinreyes3995,UgyOwxiwJ1RV31s4eYx4AaABAg,2
it doesn't matter that it's almost a year since his death it still brings a tear to the eye,@BenMinecraf,Ugx8ZULpkEyBs2-_xOZ4AaABAg,35
this made me cry,@fabianbarrientos3957,Ugz-uk8618LirZAg9X14AaABAg,1
The saddest part about all of the tributes to Technoblade is that he will never have the chance to see them.,@Han-ff6rq,Ugx7BiVPjbBHyx_vPAt4AaABAg,3
what would you do to a person to talked trash about Technoblade,@dhaynemartiz,Ugy67sMzSh1kVhJ6HRR4AaABAg,1
Man…. I miss him so much,@ImAGreenBean570,Ugy3xKFxp2Tg5qZ7ImR4AaABAg,3
one year today.,@whatismynametakeawildguess,Ugyy7FoV8dDxmeDxBoJ4AaABAg,1
Thank you technoblade,@joldotdesign,UgzT_cvW9_CggteVmq14AaABAg,0
I saluted for techno blade,@Trigger3993,Ugzh574G91IAGFz0QVB4AaABAg,0
"I was looking for music to create my herbarium... well, looks like my business is being delayed. I'm going to watch Techno. it's a wonderful animation, honestly. I've been crying for hours now.",@layzi77,UgzXn45ur2jPQsABNLF4AaABAg,0
"Even though it’s nearly been a year. It feels like he passed yesterday. I’m 21 now but I practically grew up with this man watching him become bigger and bigger when originally he was tiny and just kicked absolute ass in skywars with the funniest commentary. 

He’s an inspiration for me. I’m trying very hard to spread my own message and be someone worth looking up too. Techno is the embodiment of being stubbornly yourself. I think that’s the attitude you gotta have when your trying to be something to people, or just being a content creator (Im a musician and do game design). 

I hope he’s resting well and can smile on what he achieved in such a short amount of time. I can only imagine how influential he was to his younger fans. To anyone that is younger reading this. Go take his advice and go do what you love, or find it if you haven’t already. 

Life is too short to spend it waiting. Go achieve great things",@DylanOfTheOthers,UgyDHyHl4vSMtwT2n4p4AaABAg,1
He will go down in history as a legend,@bisquio,UgyIxNirzVGrs0YDOkZ4AaABAg,0
This video was simultaneously so fun and so bittersweet and sad. You did such an amazing job. I hope Technoblade is able to see how everyone misses him.,@oliviabranch7134,Ugz3ZrgBWJHUrJuLwRF4AaABAg,0
Loved techno truly did,@gretaloree,UgykAKtj0gvynBHDYWh4AaABAg,0
"I'm not crying, you are",@annahovgaard2336,Ugxz3wyYTuXUgKhy-ep4AaABAg,0
rest in peace... Technoblade,@reapervalentin9167,UgyrGxbJZwgs4ihzo1Z4AaABAg,0
in this month a year ago he died,@spector4292,UgwP_z8pNvjND6pZjpd4AaABAg,0
im crying ive been crying since he died every night i cry and i told my friend Technoblade never dies she said thats last ear trend,@Hika437,UgyGkTNht6MBUNTdFMR4AaABAg,0
THIS IS AMAZING REST IN PEACE KING,@Bucket255,UgwUAnMR17CSx5_oQ-V4AaABAg,0
"Its hard to believe its almost been a year
o7 king",@carlamuffin,UgxDZunkJGGD0Rpmub14AaABAg,0
O7 O7😭🐷👑The king will live on in our hearts No matter the circumstance😢,@Bigblueberry5330,UgzjAIrUKj84uOVl5hJ4AaABAg,0
DAM FAM THIS IS GOOD!,@kokisplace,UgwwocTMsyCptOilWjJ4AaABAg,0
That last part really got me good and I started crying but the techno song made me happy ❤,@Pamela3317G,Ugz-jl9P0uppVqljpP94AaABAg,0
Glad to see people keeping his memory alive nearly a year later. RIP.,@CMoneyBounceHouse,UgywII0UGPgyJy-dVFV4AaABAg,0
He would have loved this video.,@Jupiter_Mayflower,UgwQsqjzQUc7YpWlKKd4AaABAg,0
To say this is the true legend his caracter never die 😢 now is a heros for ever we lost a good one in the communoty of  minecraft ❤  well style love you tecno same if you are in a other world,@lequebecoisquebec9979,Ugxkf67PiSciZjpdJDN4AaABAg,1
My names Dexter and I am one of us o7,@mikominashi1162,Ugzw5KWyE5QVoT9bZfl4AaABAg,0
o7,@absolutecoffee9570,UgxdewSmdY292-ei26x4AaABAg,0
o7 techno-blade never dies he is always with us in our hearts and soul,@nightmarecatzz,UgzKSS5MP55je3D5JSd4AaABAg,0
I can’t believe it’s been a full year. For me it still feels like he passed just yesterday. It hurts just as much,@SapphireStone-qx9du,Ugz5vraZr5ysgLOBHRd4AaABAg,0
technoblade never die,@samuelcarter2709,UgxJETITir4iO_j3eIF4AaABAg,1
I have never felt so much emotion from one animation you are an amazing content creater and you will make it far ik you will.,@samuelcarter2709,UgxxReGjpzjM2ka49mF4AaABAg,1
Dude this got me really emotinal,@EternityWCUE,UgydFfsS0TKtiw6Ov3B4AaABAg,0
"I want to make videos like this, beauitful and meaningful...",@Phoenix.Sparkles,UgyCnY5HH1VBhdivz_d4AaABAg,0
"R.i.p technoblade

If you miss him gang
👇",@Sanstheskeleton395,UgzcusGr4cScfQTvIzB4AaABAg,0
"I found out about technoblade when he just died, then I watch some of his videos and dream smp videos, and realize what I miss, I wish I knew about him sooner, rest in peace king, TECHNOBLADE NEVER DIES!!!!",@lilianacruz4986,UgwNjcT1TT7OgxRwO354AaABAg,0
I don't much to say but something simple    like this is amazing 07 king❤❤😭,@nap_allday,UgyaafebI40KKO_XVqx4AaABAg,0
`one day we will look back at were we started and be amazed howfar we've come` man that had me crying #TECHNOBLADENEVERDIES,@silentdomains9211,UgxMyV-UP6wbrwiywqh4AaABAg,0
"This just had me from the very beginning to the very end, but I had tears of joy because I am so glad I was apart of this community, Technoblade was one of the greats and am so proud to see he won’t be forgotten. Long live the blood god 🕊👑",@goldenskeleton7816,UgxfkV7hSv7ka9yAKft4AaABAg,0
made me cry 😭😭😭,@yuki_550,Ugz3NIGKwKfI5SgjfhN4AaABAg,0
"God, that final quote ""One day, we'll look back on where we started, and be amazed by how far we've come."" always hits me so hard.",@l4dym3r3k,UgziyQprfY42esXBbJ14AaABAg,0
"Honestly i never watched techno and i don't think i'd be able to start now without feeling sad. But one of my best friends was (and still is) a huge techo fan and was devastated when he passed. Even without knowing the streamer that well myself, that ending made me choke up bc I know just how important he was to people like my friend, and how hard it is to lose someone. Man-- such a great tribute but now im crying at 12:30 am ;-;",@kentucyfriedme,Ugyud4IOwefcsqIlzOl4AaABAg,0
this is beautiful,@redheiress.15,Ugzv_upBZ9RYvJRUM2N4AaABAg,0
why did hearing his voice at the end make me cry?,@megalofightback,UgwOt5S1u0_xTKJHaxt4AaABAg,0
F cancer,@MycatLoki22,Ugyxsj4djRBl3tA_h_p4AaABAg,0
"What wise words technoblade said at the end. A wise man once said: Heros get remembered but legends never die. We will all miss Techno. ""Not even close baby Technoblade never dies! Technoblade never dies!"" <3",@Bloxcraft.78,UgwsH9AH6WG9FXLQ4E14AaABAg,1
The attention to details no matter how small in EVERY FRAME is incredible!,@TVAMPIRE476,Ugy3fKIQbg6V9e1gZxx4AaABAg,0
This is awesome,@Nothing-mk5bc,UgxBwm716ro3FPu1tLB4AaABAg,0
Technoblade never dies!,@Firashma,UgytnCW8KixRIhlmLT14AaABAg,2
"Omg from the animation, the song choice, drawing all the animators and/ or people who wrote og songs, showing all his friends, the cancer ribbons, the references, his speech, showing techno put his crown, cape and sword down as he walks away, the ending with his blitz parody of blank space! Everything was so incredibly done! Beautiful job!",@mushroom4286,Ugwz_sYhAdTE_h1z1pJ4AaABAg,40
"Eu sinto que o minecraft era uma fuga do mundo real pro Technoblade, era um lugar onde ele poderia ser ele ,se aventurar ,se divertir,ser mais feliz em geral...um lugar onde o cancer nao existe...",@ayumiyumi374,UgyZErZWSjxQip7YVXB4AaABAg,1
Rip we all loved u 🙏🏻 +123Ml.     To: 😇🐷 technoblade  :) 😢 ❤,@SaraVeryLittleBean_456,UgzpLX5zf90o3OveN9x4AaABAg,2
TECHNOBLADE NEVER DIES!!!,@Mad_Maxx.,UgzQTbSzD0meQ-3sbpN4AaABAg,2
"Technoblade never dies. In two days he will have been gone for one year. He will always stay with us in our hearts. I cannot express how I feel, that's why I am writing this comment. I thank you for this. It really helped me remember and appreciate everything Techno has done. Rest in Peace 🕊️",@zqoddark-hk-5571,Ugxi6CruAUlU8xX4Xfx4AaABAg,3
"this tribute is just... amazing, everything on this is amazing. Technoblade would be glad if he saw this (:
Really, Respect to you, Cowokie.",@shanks56884,UgxAPgPzEJMgf4HPG5Z4AaABAg,1
RIP TechnoBlade Rest In Potatoes,@protogen4lifeanimations757,Ugzg-Vvu08w3rKmhW8h4AaABAg,1
"Technoblade will never die, because he lives on in our hearts. Let technoblade always be remembered for his time, and never forget the memories he made with his life.",@StellaHelpsYou,UgwiGgOr0Y7U0rbtctx4AaABAg,70
"this is so beautifully drawn and so well done. i love how it celebrates his life and his accomplishments and friendships. i love how joyous it is. it doesn't feel like a goodbye, but a thank you. even so long after his death, i still cry hearing his voice and seeing all the amazing artwork/videos that people create of him. he made such a strong impact on people

he was gone way too soon, and it hurts knowing he could have lived for so much longer and faded into obscurity with an early retirement. it hits me so hard because my name is also alex and my family has a strong history of cancers. right now, i'm going through some breast cancer screenings because of some weirdness in my left breast. seeing him as he was—as he IS—is so beautiful and such a comfort

thank you",@AleOfCoffee,UgzMVDOfHO3VzBHajSp4AaABAg,8
"Can't believe its been a year.. This has me in tears, beautiful <3 thank you",@noenpegase8468,UgwOIeCqwKUXVEVk7KV4AaABAg,1
I was having so much goosebumps while seeing this i cried in the end,@lordfrog2984,Ugxbb0U1Ognb1riMBZ94AaABAg,1
you know life has a lot of bumps in the road occasionally we take everything for granted and not realize that time can easily pass Us by so quickly makes you think that if we just stopped and look upon the world and it's Beauty we could change something,@ColdOsburn,Ugx-sm_hSw5EWa79m8x4AaABAg,2
Happy birthday techno where ever you are now rest in pease,@ΕλευθερίαΑγγελακοπούλου-ξ5β,UgzDMqo1x4fuDEQGy0R4AaABAg,1
"My god you have me crying
  

    



Thank you for this,I appreciate it",@robbblob6703,Ugy42mNpaAjQR8a6NT14AaABAg,1
"I'm literally about to cry rn

He shouldn't have died, of all people, not him. Someone I had just started to watch but got really attached

You did amazing on this, be proud. He will see this while he's in heaven. He is probably so mad he died, we all would be.",@RukaTea,UgzrF3ULgk4OWbI1iSN4AaABAg,1
"I don’t care how strong I think I am, this is going to make me cry.
Live on technoblade.",@ocean-pj9ro,Ugw6I4oPYlF0pkBOHh14AaABAg,1
Wait no ahh I wasn't emotionally prepared to hear his voice in this my eyes started watering this is so good 😭😭😭,@forgottenmachine806,Ugz02WB7_hxJC2LHwAx4AaABAg,1
"I have a smile tearing across my face and tears running down my cheeks. This was beautiful, thank you ^^",@Grig9700,UgyEbhb4sBo2gf5KcfB4AaABAg,1
And I miss techno's voice 😭😭,@Cantasoup4,UgxjCK0azx7vYdIReE94AaABAg,1
R.I.P Techno 😭😭😭😭😭😭😭😭,@Cantasoup4,UgzQ71uHJbIe4UWA9Ep4AaABAg,1
Amazing song man!!!,@guillermo004,UgzxjlGxV5vxBLdRiLR4AaABAg,1
"Dude all the references & the animation at the beginning had me having the biggest moment of nostalgia in my entire life.
You have a talent for this, and thank you so much for adding to the list of Tributes to him, never gonna forget him😭",@Sen-ki-,UgzLU0CoosJ5JHaWFkt4AaABAg,1
TECHNOBLADE NEVER DIES!!!!! LONG LIVE TECHNOBLADE! (also nice tribute),@castlecrasher9252,Ugw5PbSIUO6CtuaY6Ih4AaABAg,1
"We all miss technoblade, the made amazing content, he is truly a god, R.I.P techno",@PicklePlayz_,UgzlxJxKgQxhsdJUXrB4AaABAg,1
The last seconds  gave me goosebumps and tears. Thank you! Technoblade never dies!,@vincenthelmers5152,UgzUhzrSwkjKy5rbNT94AaABAg,1
"One year yet, I'm still in denial. I cried so hard at this, and I don't even cry easy.",@Zya_zya_zya,UgwcMQsY_bI62cIpyj94AaABAg,1
"This is an amazing animatic, i miss him so much,  Technoblade never dies! o7",@grace.h69,Ugzf-tmVYk57UT_vvQB4AaABAg,1
It made me burst into tears. I really miss him.,@zwiastunka_,UgxSZBs_JCCSGUQNNGN4AaABAg,1
i cry $o hard thank you..,@nioko3542,Ugz_KbWCPakvXtAsozh4AaABAg,1
"I love that I get the references, but it hurts that I know the references.",@MR.UNBLADE6600,UgzvpZEQ09Y07OovLC54AaABAg,1
TECHNOBLADE NEVER DIES!!!!!,@BlueCapez,UgzTds0ILuTmFHieUL14AaABAg,1
we Miss you technoblade😢,@stephenxandermonzon9474,UgxJbYcjeEtV8WEq74J4AaABAg,1
I love this video so much. It less focusses on the true sadness of his passing but more on what an amazing and awesome life he lived. Thank you for making this.,@littleirish7785,UgyIv4VbddIeYe-Ohr94AaABAg,3
this video show how technoblade has make a huge impact to the community and shows you can make friends along your way so Rest In Peace King of PvP technoblade,@Assassin25299,UgzlMDM1s8N072MqUUR4AaABAg,1
"Goddamn, I never even watched him and this has me bawling my eyes out, god I feel so bad for everyone who’s grieving rn I empathize a lot. I wish some of the YouTubers I watched who met with tragically early deaths got the kind of love Techno is getting. It’s an amazing and incredibly heartbreaking thing to see.",@SunBeeSmoked,UgzVKNDJvGU83Nqnlgx4AaABAg,305
"It’s amazing how people can feel more for quite simply, a random man on the internet, than National leaders",@Avgthiccbison,UgzrwOjomju3pxxKsW94AaABAg,0
"Its almost his death anniversary 🥺and i miss him already


“As a wise man said *Technoblade Never Die’s!*”


Rest in power Technoblade 
    
- Techno fan",@ArtistWithASenseOfHumor,UgyBcrAoeZyds37uLb14AaABAg,1
I never watched techno when he was alive and only knew him through the dream smp and he was one of my favorite characters and then the news came and I started to watch him more and realized how much he did and broke out crying,@masterryloke4413,Ugwhh9Z0KwlgwQnaGN54AaABAg,1
I am shedding real tears it is currently 1:12 am,@adamoverloop4600,Ugyp4O_ZfgVvkphogcF4AaABAg,2
I WASNT EXPECTING TO CRY!!!!,@NotJoeybug,Ugz9w_QEDZQU-EHr1w54AaABAg,1
TECNOBLDE NEVER DIES!!!!!!!!!,@firstladyJRT,Ugylj8SIipywwr7p4_V4AaABAg,1
"This is an absolutely amazing and extremely well put together tribute.
Well done ❤",@Dragon_gaming553,UgzuON6UnH2U2NbI7vx4AaABAg,1
Cry rn,@Gerbil666,UgyKftZ8HEWPWIfqZ0J4AaABAg,1
"Thanks for this master piece continue what you are doing. 
P.S THIS MADE ME CRY",@liev3200,Ugw75dzVaRCd-HGYgSh4AaABAg,1
Y'all I have a mincraft big and I put a crown on it so TECHNOBLADE NEVER DIES,@SamBobby-fj9ez,UgyvDvyZJ7fo8_DnY3l4AaABAg,1
"This tribute is incredible, technoblade never dies🤍",@_deltawolf_,UgxR27_aQy1qYcxzDg54AaABAg,1
"This is absolutely amazing and perfectly timed. I've loved this song for a while and recently started thinking about how well it would work for a Techno animatic, then saw this! You made me laugh, smile, and cry all at the same time.",@obsessedmess3591,UgyZvgN3GKWzcIlVUE54AaABAg,1
this is too good,@timester3030,UgxLYcGFS9cCQDcX3yl4AaABAg,2
thank you,@yuresyuas8941,UgzohCbzX48i2u3xZ814AaABAg,1
"Technoblade will always be the king of MInecraft to me, and nobody will ever fill that position in my eyes.",@wandereringshadow8658,UgwwfZZ5AIhuOEj-II14AaABAg,2
"FLY HIGH KING TECHNOBLADE NEVER DIES. Even if it’s been a year, his death will always hurt but he will still be in my heart 4ever❤️👑",@Shr00m-4v4,Ugxn0PVyRRW1y-tNZht4AaABAg,156
the day im commenting is june 27th a few days before its been 1 year,@NavixGD,Ugw6wkC3nqFxJrmZ3RB4AaABAg,1
This is one of the most amazing!!! Animation l have ever seen  u got a new sub,@rose-np6iw,UgyZgS-be12JIUTStNx4AaABAg,2
o7,@LuckyHappyBumblebee,Ugwuq0nz-gCDEZNNaVZ4AaABAg,1
Even if he isnt here with us anymore he will be with us in our heart ❤,@moja8684,Ugy3z1AtqJSbACHFmmN4AaABAg,1
I'M SAD THAT IT'S ALMOST BEEN A WHOLE YEAR SINCE TECHNOBLADE PASSED AWAY! I MISS HIM! 😭,@taylorackley831,Ugw9RMCp6SEWcDV7-eN4AaABAg,1
"He will always be the #1 Potato Farmer, even if the ranking changes. Nobody will dethrone the King.",@gasmasked_bandit,UgxQEO9XMhBMMOve4dh4AaABAg,1
I was so close to not crying until I heard his voice,@SleepStolen,UgyUfzveLz0I071O7Ad4AaABAg,0
I never even watched techno but when he died I just felt pain if you play Minecraft it doesn't matter if you even heard of him you just felt his loss.,@RosaQ1W,UgyizvLGCjZ3amcSRr54AaABAg,0
"A ture legend  does die but they become gods and hero to be reamber by family friends and the pepole thay look up to tham.
 technoblade you are a hero thay will never die as long as we remember your light",@JoshuaNinja,Ugxc2-pWRtNe7Sim_RB4AaABAg,0
oh my god im gonna cry,@boxofturtles761,Ugz7RjyPVDxFeeoooR14AaABAg,0
i have left the fandom long ago but i will always remember him. (im crying aa),@alphix__,Ugy6mmtqZyiWSJ8OORt4AaABAg,0
We all miss him and he will always be in our hearts as the man the myth and the legend.,@Zach-mc8cd,UgyjgDbEZrOzsrYtfgl4AaABAg,2
o7,@Mystic_Zync,UgzqwRIQuean9lFdlON4AaABAg,0
"isso ta incrível e eu to chorando  demais pra digitar em inglês, ta lindo!",@karol.a.,Ugw5Tw9nPwNVvDtJaQ54AaABAg,0
I started crying this is amazing rip king you’ll never be forgotten technoblade,@Zozo_Eclipse,Ugw2uTSLTCe_jMXv0Z14AaABAg,0
"Techno never gets old, He never dies, He will be with us always, and 100 years from now, Techno will still live on in many people's hearts. God bless you Techno, may you rest in peace.",@fearsomegaming,Ugz8jSkhxMCMQT4X8Bt4AaABAg,51
"🌹June 1, 1999 - June 30, 2022🌹
      🌹Rest.In.Piece Techno🌹",@OhYeahItsMeeMowTime,Ugy9IlSHLTZil6jp6L14AaABAg,1
"If only I had found his channel earlier, I would've been more impacted by his death, but I could tell that he was an incredible person! I have been holding off on typing this for a few days because I, as I said before, I was new, as in a-few-days-before-he-released-his-death-video-new. I don't feel too assimilated into the community as everyone else here was.",@xadethewanderer8965,Ugwh_uQx-itcK4A7rVx4AaABAg,0
RIP TECNO WE ALL MISS YOU BUT WE ALL KNOW YOU WILL OVERTAKE HEAVENS,@masongaming9498,UgwyXdbLqOTBcXH9_6d4AaABAg,0
Listening to this on repeat.,@xyinc5621,UgyyMFfuDAeSTLCyr214AaABAg,0
"“When do you think people die? When they are shot through the heart by the bullet of a pistol? No. When they are ravaged by an incurable disease? No. When they drink a soup made from a poisonous mushroom!? No! It’s when… they are forgotten.” 
― Dr. Hiriluk One Piece",@cerbeyusplayzz9127,Ugzkl3mo1LOXASuBzXN4AaABAg,0
Love this tribute you did such a good job,@Theguythatplaygames103,UgyRJP-zIOTSQ8kGFIF4AaABAg,0
"This was really beautiful. An artistically crafted masterpiece of emotions and memories. It’s hard for me to write how I even feel about this other than commenting on how good the art and the idea behind the art was, which I have. Thank you to everyone behind this, for keeping the king’s legacy strong; although it was practically heartbreaking to see so many favourite moments in such a well drawn medium all together in one video - it made me tear up knowing I had experienced some of them when they were live and/or first came out, and that I could never be able to relive that fully.",@glitch_the_pix,UgzgV7tA-s06yevWRSx4AaABAg,0
It has been 362 days,@lectryack5056,UgxKdjX5wUrqlZJpn3B4AaABAg,0
Gloom and techno please not another soon I think we lose youtubers so fast now of days and well it hurts to see this like a lot a lot techno may you rest and may you rest happy TECHNOBLADE NEVER DIES! IF YOU WANT TO BEAT HIM TRAIN FOR ANOTHER INFINITE YEARS BUT HE WILL STILL BE HERE!!!,@dsmpedits2698,UgyW_gXZhSgxQSCvyAJ4AaABAg,1
"Ngl I would love to see a technoblade movie

PS : Technoblade never dies",@WRLDOfSad,Ugybq_7czPZxb5JUNqN4AaABAg,1
he had another channel called Derp Squad https://www.youtube.com/@derpsquad133,@harry36-gg,Ugyj0xDkGgP7CTxDEwR4AaABAg,1
"My king, technoblade!",@Atomic-dragons,Ugzqgnz8QMvUjoiSNLh4AaABAg,0
Tehcnoblade never dies! I’m actually tearing up at this😭,@Mrfroggy_,UgzXFmDrrQokHSuRufF4AaABAg,0
Rip Techno respect to The OG,@MamtaThapa-gf9nq,UgyHRE0rwi410C5j9SJ4AaABAg,0
Stop I’m crying,@TVHEAD69-247,Ugx5oYe4-pv7Gs1BbH54AaABAg,0
"I'm exited to see what awesome videos you'll upload next.
Thanks for reminding us of those incredible moments. #TECHNOBLADENEVERDIES 🐷👑",@Cryo_CruisE,UgwRkC9GbaJTtq2-eP94AaABAg,0
We shall n3ver forget technoblade he shall stay in our hearts till the end... technoblade you will never be forgotten..,@unstable_person,Ugz6Z0NdQle0fLzKoiB4AaABAg,0
"We will never forget about technoblade, he will always be in our hearts, he will always be a legend and his legacy will live on! TECHNOBLADE NEVER DIES!",@skyvvy4509,UgynSVxSMWHD5VNeU694AaABAg,26
"Im litterly crying right now because Technoblade is a legend and always will be, we will never forget about him💖 i hope one day we can tell our children and grandchildren about this legend😭💗Rest in peace Technoblade we will never forget you king💐",@Technoblade_never_dies20,Ugy95xugRWQRfP7oCxF4AaABAg,0
my HEART CAN ONLY TAKE SO LITTLE,@chaoticchild6897,Ugz9X3ztQSRx7jxAKv14AaABAg,0
#legendsneverdie,@billlynn5345,Ugy6hhk6PRvrEP--Ntp4AaABAg,0
best tribute,@prajin2695,Ugyw5NC-aHAsoCXIUQh4AaABAg,0
i am in love with this,@simarjeetsingh9083,UgzaS0VqJmtUmGNKqBF4AaABAg,0
man you just made me cry,@simarjeetsingh9083,Ugyb3-15IsrAtCq3xyN4AaABAg,0
TECHNOBLADE NEVER DIES!!♡,@Crystal_7062,UgxXgW0ILboJ2wFpSzh4AaABAg,1
We will miss you king technoblade never dies!,@Silver_shark120,UgzYW9iZwrbhTu7tKR14AaABAg,0
The choice to include his dialogue from his first hypixel skyblock video is amazing.,@ThatDude-gn4ev,Ugw_tqI3ATw1T9LRPQl4AaABAg,0
This is the best thing I had been re-watching his high pixle series and I got this its not like I really knew him but he honestly changed my life I was depressed and he really did keep me going thank you rip and TECKNOBLADE NEVER DIES!!!,@austinculp8049,UgweoeVEuafXO4GI6jJ4AaABAg,1
"Technoblade has such a special place in my heart and soul, I couldn't finish listing all my reasons for thanks if I sat here for hours.Technoblade never dies.",@whiskers1102,UgzyoL6B9YNxL04_G-t4AaABAg,0
"A fantastic song and animation
Genuinely, this made me feel a lot of things, and the song is just.. Inspiring. It's now in my playlist for whenever I need that reminder to keep going, and fight the good fight like Techno",@snamorta,UgwIh9bPmIZN12WGTdV4AaABAg,0
Technoblade never dies,@renkii0,UgxuGb43XaL-L53o3P54AaABAg,0
You made me cry so hard and im still crying Rest in peace Tevhnoblade we will always remember you and we hope your doing good up there you inspired so many ppl rest in peace!! and just remember technoblace never dies!!!!,@Katismyonlinename,UgxU0wSB2saNDqQrVR54AaABAg,0
blessed be the blood god o7,@FamousRapperLilJacob,Ugxp3qj0NIhSkPmU_AB4AaABAg,0
Truly amazing his legacy is this large,@joe2578,Ugw9q20NREviVsEvTDR4AaABAg,0
Rest in peace nerd,@NNinee9,UgznfsYBwJExsK5h7m54AaABAg,0
"""Do not go gentle into that good night,
Old age should burn and rave at close of day;
Rage, rage against the dying of the light.

Though wise men at their end know dark is right,
Because their words had forked no lightning they
Do not go gentle into that good night.

Good men, the last wave by, crying how bright
Their frail deeds might have danced in a green bay,
Rage, rage against the dying of the light.

Wild men who caught and sang the sun in flight,
And learn, too late, they grieved it on its way,
Do not go gentle into that good night.

Grave men, near death, who see with blinding sight
Blind eyes could blaze like meteors and be gay,
Rage, rage against the dying of the light.

And you, my father, there on the sad height,
Curse, bless, me now with your fierce tears, I pray.
Do not go gentle into that good night.
Rage, rage against the dying of the light.""",@Alkimachos,Ugy9TKEZq9KmFB4lUKZ4AaABAg,0
o7 thanky you technoblade for starting my journey : ) even if i am telling this at the wrong channel 😊,@FailureManagement,Ugxet_m9KofsLUOsQ1J4AaABAg,0
idk why but i still dont belive hes gone if dosent feel like it,@MackenzieSpitz-e7b,UgyxKIBoX41Y-_1UIh54AaABAg,0
"Happy Early Anniversary Techno! I miss and think about you more and more every day, i hope your quest to defeat god is going well!",@WispUnknown,UgwrNimUIMeD1S5yzrF4AaABAg,0
"Still waiting for the: ''Haha, happy aprils fools, you nerds!'' (I'm in denial)",@solo-juli4339,UgzOa8NS0I3FWIpzWQJ4AaABAg,1
