Comment,Author,Comment ID,Like Count
"i was just on hypixel trying to find techno then my phone gets a notifacation ""So long Nerds"" i was like what? so i click on it and when his dad said ""Hello everyone if your hearing this, I am dead"" i imeadeatly paused not believeing it. Then i started balwing he was allways a huge insproation to me and i had always wanted to find him and get a screenshot but i never got my chance and still today 1 year later i cant watch 10 seconds of that video without crying he was more than just a youtuber, Technoblade Never Dies. O7",@Clickzry,UgwXZrnBofWzYbvoSZt4AaABAg,2
"This is SO good.  I can't articulate how well this captures the joy of Technoblade's videos, and the way that all the artists and creators wanted to *do* something.  ""It could have been me.""",@StrawberryGS,Ugx5mUhrqzwJ8yBYvd94AaABAg,0
o7,@bangkys,UgyfZMzlAxjGyDhtT4J4AaABAg,0
Technoblade never dies,@Mrnovagamerz,UgzcEWRNU9LoixKB0_t4AaABAg,0
IM SORRY TECNOBLADE,@annalisegarrett5063,UgyWPakQreo_Jc_Maxd4AaABAg,0
"Thank you technoblade the Legend 

o7 to the king",@aamh505,UgzUx0Cc_eoF4mUxqUV4AaABAg,0
We can thank techno for bringing back the Minecraft community stover then ever this biggest of livestreams don YouTube the epic tournaments now we will not let it die ever again always in memory of the blood god  technoblade never dies,@yomacplayz,UgwsKf6cSH_2wxjEtYV4AaABAg,0
🖤🖤,@lky1639,UgxUeyoBZIW-Sz1gSVZ4AaABAg,0
Im so sad,@Zenith-AZF,UgyWECiVchLE_6W2ctl4AaABAg,0
I miss you techno it's been over a year since you died and we still miss you,@catmungo4500,UgwMuZkAYjFBe9xOnpx4AaABAg,0
"The fact that his elbows have a little shine at the start is a very little, yet so important detail! Respect to you bro!

R.I.P Technoblade",@Parker_Gryffin,UgwhFbxOnUEGV5kkY9Z4AaABAg,2
Respect,@stanleywathern530,UgydoPpXeO37qBV3HBl4AaABAg,0
"Oml I was about to CRY I’m making Technoblade cosplay and it has been so long since I’ve started. I started it before he died but will continue in his name.
Technoblade never dies.",@Blep_Edits,UgxZESlARmDdIwUmVxJ4AaABAg,1
Technoblade never dies,@Toji2759,UgwqZ6sQq5sdlR_aAXF4AaABAg,0
"Technoblade never died... He logged off of his game to go play skyblock.... R.I.P Technoblade You would be proud if you saw how much the comunity misses you, and what they have made for you....",@TaylorGamingYT,UgzSbvZZCTfbFX0g3EF4AaABAg,1
Rip 🪦,@Toji2759,UgxeDME6kRjDctlkHRV4AaABAg,0
"Thie is an amazing tribute to him. 
o7",@ploshthacatMC_btd,UgxLwePBEKKzDI-9RFB4AaABAg,1
"There's something so amazing about watching this a dozen times over, then understanding another reference almost every time",@M15FIT,UgwKYWrYTxKXWZsQ8YV4AaABAg,0
The quote at the end is so perfect,@marialuna2784,UgyLNhEPY-KLuh7QGbN4AaABAg,1
I have no words,@Rodlogicmusic,UgwRD3pEVmWta1xKSfZ4AaABAg,0
"Sobbing at 3 AM because this absolutely took me out. The tears started at the Cancer Badges, and then poured at the artist pen widening the screen for all the memories and people.

We miss you, Technoblade. Fly high, King.",@turtle22phoenix,UgxWzCZJVOKmSndlcQx4AaABAg,0
oh i cant techno never fucking dies bc even when we forgets him just one bit of memories of him and u rembember him again and u cant take out techno blade in your head so u keep crying,@eithanjamesongjoco8374,UgyhV0HmWE74m9yZeVd4AaABAg,0
"o7. 

The king Techno never dies❤",@Kangel.Ame.,UgwWHN72yg9Bmg8Q29F4AaABAg,0
"""technoblade never dies"" 
that was the last words i heard from him",@B3llap3achTT,Ugy7Ub0eST00Ij7wCvp4AaABAg,0
Bro im crying rn rip techno,@_yoshi.,UgzL48MyJS1C980AH714AaABAg,0
Technoblade will forever be remembered.,@LooneyTooners,UgyEMjGqOMcqsuceuBd4AaABAg,1
"there are some videos you just can't click off of, this is one of them",@Master-builderemet,UgwwpuRckGMaCQeOnu14AaABAg,0
"I just love how it also shows how he inspired so many ppl. So many ppl started something because of him be it music, fanart or even whole animations. Those ppl won't just stop because he is now dead and they will probably inspire someone themselves one day. So in a sense his legacy will live on in those ppl. 

Technoblade never dies.",@christopherandresen9790,UgzAcCj2zuCnJ7rSTXB4AaABAg,0
Blood for the blood god,@xanderquinn6010,UgzP07tV0sIudoIDsm54AaABAg,0
I have one thing to say...,@xanderquinn6010,UgywuSXK0Os6rDPo0gV4AaABAg,0
A year after his dead.... Hes still didnt forgotten by so many people... Respect❤,@fahrulofficial526,UgxeehCuE8jErD0jlBN4AaABAg,1
"Thank you for making this, R.I.P. TechnoBlade and W Technoblade rest in piece",@SuperRelaxMusic-oi7jy,UgxTv1QTQumzSanl7vR4AaABAg,0
the technoplane capturing whole world got me real good,@RaviKumarroh,Ugy9jd5_7E1U7jpqltZ4AaABAg,0
O7 chain,@2009_f1_car,UgzICkEdrdQeTeLLOZZ4AaABAg,0
technoblade never dies,@thanhvho8885,UgyIgCZM7-7YAMbEmD54AaABAg,0
Why am I crying so hard………..😭😭😭😭,@sandycanfield1773,UgxpbrKuIv4g9b5f94R4AaABAg,0
"Caramba q animação incrível, Parabéns! Vc me fez chorar de verdade, e olha q eu não acompanhava o Technoblade, eu o conheci por causa do Philza no QSMP, mas msm assim seu vídeo me emocionou.",@GarotaAgiota,UgwYvwmBd-KALkusWKx4AaABAg,0
"I've had this pinned in my browser for a couple months now, so every time I go on my computer, it plays. I bloody love it. I'll never forget Technoblade and that's thanks to the incredible animators like you. So, thank you and Technoblade Never Dies.",@dirtbag.49,Ugyda18E--qz5Q4auaN4AaABAg,1
"watching on the 31/8/2023. 
I  miss him, every time i see the sunset or sunrise, and thse clouds shade into pink, fuck, i can just imagine him smiling down at us.",@GhostKrow_,UgyxkjODuuhYdSyZV7l4AaABAg,1
❤❤❤❤❤ 🐷 o7 king,@jetboy531,UgwC4g0zk65FzPiaLi54AaABAg,0
Thank you,@jetboy531,UgwSwc5MbkuwuG0FBdZ4AaABAg,0
"one day i was playing bedwars and i destroyed a bed a guy comes from behind and kills me and the name is ""technoblade"" i was so excited i finally met my hero... two months later he has stage 3 cancer.. another couple of months go and my hero's past. i cried for hours just watching stuff about techno. he was our king. he was our hero. we loved him. technoblade... never... FUCKING dies",@CanOfSoop,Ugzt-9STaN09kLJx4KV4AaABAg,2
I just keep watching this.,@SkullxFreak,UgxlXT9_BAzmQwepuBt4AaABAg,0
Rip this is great techno blade is in all of are hearts and TECHNOBLADE never dies,@Thatoneguy-yt3fc,UgwiGpD7lxCgYrrXtUt4AaABAg,0
"You made me cry man rest in peace technoblade I wish he never passed away 

Technoblade.",@Markdmiski,UgyV4uZaSLlIkTDnIzF4AaABAg,1
Screw cancer.,@Dill_Pixel,Ugx_O9Y2s4h0h0jBDXN4AaABAg,0
"Almost cried
Thank you technoblade
o7",@aryaosel5638,UgzDusRZwajJklDY3dp4AaABAg,0
we love u technoblade,@GlobalExploria,UgxnFJeYJft2nxhttoV4AaABAg,0
jesus im cryin again on a school night my face is gonna look so puffy again in the mornin gosh i miss him... (amazing art btw),@emilygrace2995,UgwYKKIb7QQC3lqxxHZ4AaABAg,0
"1 year, god, how have I lasted this long?",@mrwannabe07,UgzvPY709TZ7sWPDto14AaABAg,0
I’m legitimately crying in fright now this is beautiful,@friend_i5_friendly,Ugze9gURvh1Hth9MB014AaABAg,0
Thank you.,@sarahpersaud5051,Ugwr_oqoAP5FB-zJ0RR4AaABAg,0
I can’t stop coming back and watching this. It’s still an amazing tribute.,@King_Malachi888,UgxY5SLZYflLgbxteJ94AaABAg,0
"There once, was a blade
Sharper than ever
The blade cut through everything
The blade, never lost a single time 
But who knew, the rust inside the blade
Would eventually cause it to collapse
He may be gone, but he will never be forgotten

You may now, 
Rest in peace, Your Majesty",@HonnaC,Ugw6_auhJvEKYWzdi2F4AaABAg,1716
"This is such an amazing tribute. I could literally pinpoint each moment to each video they appeared in, this is amazing!",@MCshadr217,Ugwb2X3qStibhYVZhGJ4AaABAg,0
"Watching this for the 1000th time after hearing the song again on Instagram. 
Shit has me crying all over again, it’s too good man! God I fucking miss him.",@JackdawMori9510,Ugyn8bGTe4fY8n5A2dB4AaABAg,1
"He’s really gone. . . Legends never die, Technoblade. You never will die. You live on, Waging war.
Good game, man. Good game.",@humblegaming7988,UgwApoLniLqOkzxVed14AaABAg,1
"The day we lost techno was the day the world  stood still and even over a year later we all still fucking miss him so fucking much thx so much for this video❤

TECHNOBLADE NEVER FUCKING DIES!❤",@Donte-416,UgyT5zBP-KidjMMCbE14AaABAg,1
"god i'm still crying when i see a tribute for technoblade, its been over a year....",@zndxclips4810,UgxkjqRnirFHwpMwfLl4AaABAg,1
"I was never a veiwer on his channel but every mr.beast video or any other video he was in , he was nmy favorite part. Tha time when he eascped prision to win a fridge just is the funniest thing ever to me and I will always remeber him as a sweat but also an amazing guy!",@zachnewton491,UgzrJF0xQSnwccGNwB54AaABAg,1
"I know no one will read this. But I have to share it
I remember the night the video was posted. I was chilling in my room and suddenly ""Techno upload!""
I got super excited, clicked and was surprised with the start to say the least. When his father started reading his last message, I just thought it was fake for a while. I couldn't believe it was real.
The video ended, and I was confused, I called my mom and told her that a youtuber I liked had died (just to make things clear: english isn't my first language so I never talk to my parents about english youtubers). She gave me a hug, and that was it. I kinda went on with the night 
The day after, I remember that at some point it finally hit me. He was  gone. Really gone.
I spent nearly the next 3 hours crying, and everytime I think about this I cry again and again. It's been a year now, and I still can't get over it. He was my idol, a friend that I never met. It was my dream to in some fan tour talk to him or something, but oh well...

I miss him. We all do. But he will never be dead, his memory must shine forever :)
TECHNOBLADE NEVER DIES",@mayazinhagameplays,Ugz5tlLXzsDP_RTRPYx4AaABAg,1
i cant hear you I DONT FEAR YOU!!!!!!!!!!!,@parrot_drag5310,UgzhyXpMTAwBg1OcQpx4AaABAg,0
fuck yeah technoblade never fucking dies,@KamdenLutterman,UgywGWYOaMMMJDs6M_h4AaABAg,0
"Thank you for making this i've  been really really sad about it, this really helped",@BlueFlash-fn4jh,UgxPovEqwVC1aJ7LWap4AaABAg,0
😭😭😭😭😭😭😭😭,@laramayhalfpennytheARTIST,Ugyy6epE0OmxlxGsNyF4AaABAg,0
TECHNOBLADE NEVER DIE ! QAQ,@Nick.w.,UgzH3h249fCR0TtT5b14AaABAg,0
"man, i really thought i had pushed through the grief, but this got me crying like i was in the midst of it again,,, although, with a more positive feel to it. i really love how you depicted people getting inspired by his content and creating anything and everything because of it, it was a really beautiful representation of how he will always live on, even in creations on our own. thank you, this is so beautiful <3",@quixxen,UgytkO-CVKoSJJCTnwp4AaABAg,1
"Rest and eazy king go kill god up there 

Trchnoblade never dies",@syahmiaiman8612,Ugxa1_S-PWz9Qg0B6ph4AaABAg,0
Miss him.,@friendofyours7,Ugy1hoIxMpGDKz5ymql4AaABAg,1
That absolute elbow reveal was beautiful…,@puffboifedora6831,UgxheHjvGWxiX6vrBhB4AaABAg,1
Long live techoblade 😢😢😢😢😢😢❤❤❤,@crystalframe7516,UgyFyB7i6xgIQd7a4Qp4AaABAg,0
why did i watch it 20 times,@lordfelgrand4559,Ugw04kOQ8qN8YfQ7raB4AaABAg,0
https://youtu.be/4mzxAkAgj_c,@archiieeh,UgzQ5orOAQb8RAgmeCx4AaABAg,0
PYRO 🤨,@ineednotfound5598,UgzerPxiX1GMC0wBgL14AaABAg,0
TECHNOBLADE NEVER DIES 🐷👑⚔️♥️,@nuggetteacup1747,Ugz5Dvs1pkZbu_pcZzB4AaABAg,0
The style reminds me of The Adventure Zone :),@TheDollcast,UgycFlaZJO7UOzbWKpZ4AaABAg,0
"Ok, idk why but of all things I'm choking up over the fact this tribute has nearly 1 million views. I hope Technoblade's legacy continues to be remembered and celebrated with amazing contributions like this from the community. We knew him as a YouTuber, but he was an entire person with hopes and dreams and a whole life behind and ahead of him, like all of us. And like so many others, he fought cancer while trying to make the best of it.

It's weird, I watched his videos often as a kid but drifted away as I lost interest in Minecraft. I never appreciated the fact he wouldn't be around forever. He was like one of those distant relatives you get a quick update from xD I'd watch a video or two every few months, where I'd feel a quiet happiness at his growing success and move on. I didn't appreciate how short of a life someone can live while still making an invaluable impact. I know if he had lived longer, his memory would be just as incredible. And I guess that's all we can hope for in the end.

I'm sorry and wishing the best to anyone's who's lost a loved one, but to cancer especially. One day we'll rise above it.

Technoblade never dies ❤",@CarbonLottie,Ugy8zvVMT3tuRkMFhct4AaABAg,213
thank you,@oddly1215,UgyWwtBAGI4cnLPqnad4AaABAg,0
he would have concured the heaven till now ..... technoblade never dies,@toistic2484,UgzevEDDmieYtxPR7I94AaABAg,0
"I don't usually comment on videos,but I just wanted to say 

Thank you tor making this.",@dr.alistein611,UgyZJi8SevCLaqFf80t4AaABAg,0
"""Technoblade never fucking dies.""

- Tommyinit 2023.",@Youreallyreadthis,UgzKU1mNBemowLW6f3F4AaABAg,0
"its been a year and a month since his death, we will keep him in our hearts",@s.python1122,UgzKUAZMA4O81Vcr0dp4AaABAg,1
this is amazing. showing his rise and even tho he is no longer with us the people who followed and supported his journey banding together to honor his memory. R.I.P technoblade o7,@bradyhiam,UgwuvlfIen6NEsMjMOV4AaABAg,0
love TECHNOBLAD never falls,@KevanThinuk,Ugyd-9vPIgt7lZMfxXV4AaABAg,0
"If there’s one thing Techno inspired us all to do, it was live.",@cairoraiser9338,Ugxi5eg7PNIOH1J9FNx4AaABAg,0
"this made me cry 😭
absolutely amazingly well made",@Randomii15,UgyO91qDM05yVFeu2k94AaABAg,0
TO FUCKING TECHNOBLADE (SALUTE),@Endergentlman,Ugzvc_UXofPluOrZeHt4AaABAg,0
cant control my fucking tears,@therealsg_,UgzbeHHw1Du0Pkqrn994AaABAg,3
Damn I miss him a lot :(,@rhielyie,UgwoiLmHk6pJGa6M24d4AaABAg,1
TECHNOBLADE NEVER DIES!!!❤🎉,@enderpanthercraft777,UgwdjHyUuWPdmG6zmpV4AaABAg,5
Tecnoblade never dies he and clay are the best minecraft players ever exsited. Well clay is still alive. But tecno you may not be in this world with us but you will always be in our heart no matter what happens. May god bless you tecnoblade. I just wish you and clay became frends faster. Hope you wen't to heaven. God bless us all.,@Potchi476,UgyY7D5WX0xOvtPlic54AaABAg,7
TECHNOBLADE NEVER DIES !!,@Theeeeeeeee66,UgyWjHUlYP1GF54gxz14AaABAg,2
"Man time Flies, I still miss him though.",@BestCryptix,UgxaCZiGJz8RQsHVFyx4AaABAg,0
"came for the music, stayed for the blade and the awesome art. rest in peace king",@rradar689,UgzDasCcQCkt9MoP8oV4AaABAg,0
o7,@---jp4od,Ugy7AttH_7e4fLzJ6mB4AaABAg,0
"“A man , is not considered dead if his name is still spoken.. only he is considered dead when his name is unspoken, but that can happen cus TECHNO BLADE NEVER DIES!!” - a wise person",@Khrustykrabs,UgwZmdccVhDECoBOmwZ4AaABAg,0
"You had me subscribing half way in, this is a beatiful animation/song.",@toymasters,UgzC77Y4YVikWqfSFw94AaABAg,0
i just wanna say that technoblade will be remeberd you can be really proud of yourself thank you for all of us,@zdenekpohl4728,UgznvYohnY_mrIfvvuZ4AaABAg,0
"Starting the stream, With him and his team. Nothing is flawed, when it's blood for the blood god. When friends are SUS, you'll become one of us. Don't fall for a bribe, you must subscribe. No matter how the enemy tries, TechnoBlade never dies...RIP 
It's been a year without u, king, Miss u",@Ace_of_Storm,UgzZPmZsJ9Lk9y3uOIR4AaABAg,0
:(,@ellieelworthy7745,Ugwq98VjypcsxO8LQOF4AaABAg,0
0:50 epic,@KingTheGrea8,UgwuIX0LGeCzZx2jOVN4AaABAg,6
Imagine the young kid just finding Techno’s videos not knowing he is dead yet … i wish i could watch his videos again for the first time!!,@contraul,UgxJVvfqaXz-dHfHA814AaABAg,1
"You know, he said he never dies. And yet he Failed  us. Oh, well, I mean, I won't die no matter what I mean. A true legend actually never dies, . That was a lie, just like the intro was shrek. Where he says like that's ever gonna happen.",@christianaustin2349,UgytSmAXg2T_edlhD1N4AaABAg,0
I love this so much thank you,@Beach5ide,Ugzjy2gkU9F3SKMhpq94AaABAg,0
Technoblade Never Dies o7,@solo834,UgxZtj6hndlYn38Ur0l4AaABAg,0
O7,@Fatement,UgynBGZ74uJdBsPnW0F4AaABAg,0
Technoblade Never Dies,@LGR22,UgwGZ49-ruuGZPdyn8J4AaABAg,1
Technoblade’s legacy will continue to live on in our hearts he will never die!,@Hiddenpotatotheoneandonly,UgyQevKxIlZWpYXHks54AaABAg,2
o7o7o7o7o7,@reggy_rasie,Ugwk5A4pCt5nF9i6TTJ4AaABAg,1
Don't be sad since it's over be happy because it even happened guys we all miss you technoblad but thanks for the fun time with us we love you technoblad,@reggy_rasie,Ugw_vsqcOPif2nosw9B4AaABAg,4
I tried making a technoblade tribute but I was in an awkward position so I drew him bad :( I’ll make a better one one day.,@CasualCatOfficial,UgxhhzsXqh3azsSCYVx4AaABAg,1
Rip techno Ty for making me happy,@youtub31313as,UgwJ9wJw-ZOjGFZ1-aR4AaABAg,1
Technoblade Never DIES!!!!!!!,@xiuqinweng9921,Ugz-Jd2G73ERr_qZsSJ4AaABAg,1
This had me tearing up in the first 30 seconds 😢😢😢,@Beastyboy363,Ugx_z6pU34Sm0Bh5w3h4AaABAg,1
Man jesus you overdid yourself,@Shatterize_,UgyKSA-RReRcC3SOdGB4AaABAg,1
"good job mate 
had me in tears, i think techno would've loved this",@thanatosgreekgodofdeath1684,Ugw1ZICdj0cAFLxqRcp4AaABAg,2
Technoblade never dies✊✊❤😢,@moazelmorshedy903,Ugw9NbKrmgD2kkFRZTN4AaABAg,1
May Technoblade rest in peace,@yoseflala3464,UgxPNbLmKdwAwgximqV4AaABAg,1
o7,@nimonafan4life,UgxUHr6EjVq9BYxtrW94AaABAg,1
He would have loved this so much. This is one of my favorite animations,@thepaintedpixel1541,UgysvFhTk7pQ1KKUD8Z4AaABAg,2
We’ll never forget you Technoblade your legacy will ever lived on and Technoblade never dies🐷👑,@derekmorcelo8290,UgzrXeyg4s3dxvBVvF94AaABAg,1
bro this had my crying so hard i could barely breath he is the best he was my comfort streamer he is amazing rip king i need him here,@HHviaKristiSchmitt,UgwiaGyZ0xrXtHM9Uvd4AaABAg,1
rip technoblada ps i love this,@DarkFam_eyes,UgzvztL8B51SwZlK6gR4AaABAg,1
Just seeing the title I broke down in tears. Still crying through out the vid gonna cry through out the day <3 I miss him 😥,@Mikka10_bleb,Ugziz_rpffsqJK1bDpV4AaABAg,1
What song is this,@cassandravarner6910,Ugx47dAFYFhjmRLOf9R4AaABAg,0
If techno was alive he be so proud of yo,@vickyneath3018,UgwVwRo1bObTnyFpPih4AaABAg,1
I will think about him forever,@karenmurphy2294,Ugw8rBGJTk8VgPax4pN4AaABAg,2
"This makes me wanna cry all of the memories, and everything he did to make us funny, rip legend fly high.",@ruby_iscookie1243,UgwO-gmy9fHaIY3xO5V4AaABAg,4
I have watched this almost every single day since it came out and cried almost every single time. This is so amazing and shows so much of Technoblades times in Minecraft-even some times that people may have forgotten or have not thought about often. This is so amazing and Technoblade Never Dies. 🐷👑,@ShakingMyHeadZM,UgypvfB0rZr1eKpt9cl4AaABAg,18
rest in peace technoblade you will be missed,@B.R.U.H52,UgzQDd41I5zw16nRa6N4AaABAg,1
He went to conquer the kingdom od God,@Hexo_Hexo,Ugx6ZQ6K55ZQbaj-iEN4AaABAg,1
I hope he sees that.,@Hexo_Hexo,Ugw7aZxiN9IGb7PA_bt4AaABAg,1
I want this song at my funeral,@sobasicallyisuck7656,UgxG06tqvsg8AFxsvYp4AaABAg,2
o7,@gxg7746,UgwqinmaSXUMnqMrBsF4AaABAg,1
"Thank you for the cry. I think I needed it.
Really miss techno all over again tho",@aleronshmidt3688,Ugx4WeefFiwZn-rFGvB4AaABAg,1
"I have to say that I found it difficult to watch this at the beginning, but now I just love it. I'm so happy you have made such an amazing tribute to the blood good ^^♡",@wait_wtf,UgyVofH9u67aDHH-Kvl4AaABAg,1
I cry ever time,@MelindaDoiron,UgwJIiY_afyzN6NA8Qx4AaABAg,1
The hells this guy only at 79k he needs more,@DugzBugzandStuff,Ugyx5-xa5_EEjuzhEsl4AaABAg,1
"Just realized it's been a year of this being uploaded, and I still haven't commented.

Thank you for making this, so very much. I watch this from time to time and I still get teary-eyed. 

I didn't really watch Alex's videos that much, but it was still really sad for me.

I knew he was a giant inspiration and role model for so many people in the minecraft community, and I remember Dan playing bedwars with him like a few years ago. I still remember what team they were on. (11)

I really hope that his legacy lives on, I can't donate to the charities in the description, but please if you are reading this and you can, please do. 

We will all miss you, Technoblade never dies.",@CabbageKid1118,Ugw8j8pr96Dytic2eoR4AaABAg,1
Your region doesn't allow you to join a fucking fundraiser? BRUH!!!,@masongaming58,Ugw6F2M8Bs7JdOSu_yR4AaABAg,1
"I wish I had watched Technoblade stuff before his death. I knew that he existed before his death, but his passing was what made me realize how amazing he was.",@itsdab2763,UgzEdLjMJC7QcvOpo414AaABAg,218
I have watch this over 13 times,@4lcryt,UgxdwyFHh0xke-qxyQF4AaABAg,1
And i cryed at 12:PM listening to this,@razer4504xx,UgwOHZOm2p93SRuCjjN4AaABAg,2
May techno have peace all hail the king RIP techno RIP,@razer4504xx,Ugx0CvTeJMFI9PCNfOV4AaABAg,2
Techno never FUCKING dies,@PSshuttle,UgwAUNAizV4v_39y2H54AaABAg,0
"TECHNOBLADE NEVER DIES
he will always live in our heart",@Millie-dd6eq,Ugz_tANRfrB5iauOLZF4AaABAg,0
"""IM NOT CRYING, YOU ARE"" is how I feel now",@ScarletMaroon-k4e,UgxLopJeKcCp_xk73sd4AaABAg,8
💖,@dongobongo1869,UgxM3lSasEFYoqgpaFN4AaABAg,0
"o7
He may never post again and be gone from our world, but he will never be forgotten let his legend live on in our hearts forever.",@P0tatGodUltra,Ugwm8tbNkxFfBWmcPE54AaABAg,0
"You got me bawling my eyes out in the car. And I like never cry infront of my parents. This is so amazing, you should be proud, truly a work of art for our king o7",@Kylee_Levi,UgyFSWWsCe-BrI7W3Pt4AaABAg,0
I cry now 😢,@bellamcarthur2883,UgwX_UfBq6qvLJFioQl4AaABAg,0
You just know he would be calling us all nerds for us crying over him,@Potatoguy-qd8ei,Ugx7ApdHgBpFH6PieHF4AaABAg,1
"Well The King is Finally Done with His Adventures,Videos,Stream,And Being a Good Friends to the Youtube Era. This for all the Memories and Loving we Had for the King of Minecraft For Every1 Say This in The Replies ""Technoking and Blade Never Dies!"" Goodbye Technoking R.I.P June,1 . 1999- June 30 2022",@VenzCent,UgxqhL81tVmx7nqgA_R4AaABAg,1
AWESOME JOB TOMMYINNIT AND TECHNOBLADE,@antoinethegamerboy3833,Ugy2SLVhnojRXtzNmqJ4AaABAg,0
TECHNOBLADE NEVER DIES (im sobbing),@enderpanthercraft777,Ugzpl8V-1gX_FzCnwI54AaABAg,1
Ok look this video I amazing but when I search “blaze of glory” this song does not show up,@NoahDiLorezo,UgzZTx_bvDUdyn5wEAB4AaABAg,0
TECHNOBALDE NEVER FUCKING DIES!!! ❤❤❤,@Emzy_07,UgzmO9djqTa-FRnI9ml4AaABAg,0
🕊️❤️👑,@PixelatedPixelz,UgzNthA7B52SCLTRxr94AaABAg,0
"if you put technos song blitz and put this animation its like they made this for blitz but shengs it also wane he said the woold waid world it put a map munsheng the song😮😮



also i love this🥰😍🤩😃",@ريانالحريتي2000,Ugw28gboykSRofWY3Zd4AaABAg,0
I can’t stop thinking about that one scene when technoblade says”I speak in 3rd person all the time haven’t you heard my #1 praise technoblade never dies?”,@randallfarley6796,Ugy-dlTtv5lWecHqCBp4AaABAg,0
It was always the best of times.,@hyshade5132,UgxqOTN9ipI-uBzmADt4AaABAg,0
他已成传奇,@陈新小说家,UgyFk66faFtqzSNe13t4AaABAg,0
When I heard technoblade died I cried I was crying so much and I don't cry so much unless my family member dies or a friend and this mad me so sad R.I.P TECHNOBLADE😭,@AssassinPikachu_,UgxNHijU15faOw4Ezn14AaABAg,1
It’s crazy that it’s been a year without him. He will always live on in our hearts and as a legacy. Techno never dies,@Catqclism,UgzxPvXlL2eVnsZcojl4AaABAg,195
"Ive seen a lot of technoblade tributes but this one is definitely my favourite because it really shows all his minecraft achievements so well, love it R.I.P King ❤",@bigmight2358,Ugxkye_K488zAuZvrmR4AaABAg,15
"Technoblade never dies!! ❤️ 

This brought tears to my eyes remembering the good memories of his life. It still doesn’t feel real, it still feels like he’s still here, and I think he is, in a way. This tribute is gorgeous, uplifting, full of energy, and an embodiment of everything Techno gave and gives us; laughter, joy, and community!!

He truly lives. God, he inspired and impacted more than he will ever know.",@seineevee,Ugw3y1kKjwF5ZBI9ZvR4AaABAg,0
I got sadder the more I recognized every video I laughed at years ago,@MagicianKarp,UgxydK9OLX6KgeizSeF4AaABAg,0
0:02 a frame that shows pyro from tf2,@pescadosoldier546,UgzK7IZ7stdxboJNlFh4AaABAg,0
this inspires me in life.,@doritonoob7731,UgzgKTHhStCm80dt_lh4AaABAg,0
i didnt need to cry at 10:42 am today BUT I GUESS THATS HOW ITS GONNA BE,@BatsuBatsu321,UgwFCb_3oT-X-G_NILN4AaABAg,0
I wish this song was on Spotify so I can hear this amazing song and without being on yt (technoblade never dies 😢🐖),@ThatCow,UgwdieG8nH8COzF8mEN4AaABAg,0
Technoblade never dies,@jobson5860,UgwTiAucO-Z3uwtWT594AaABAg,1
We all know even a general retires. Technoblade never dies o7,@JoshGian,UgzpOBsxD_P6Bth4aGt4AaABAg,0
Rip technoblade we will miss you,@judahlongoria2812,UgyC680dqGPmy3t9khN4AaABAg,1
"Everyone, My name is Petey101, and, even though i'm young, i have been greatly influenced by technoblade. He was a legend to all, a friend to most, and symbol of friendship, kindness, and power. Technoblade never dies. Even though my current minecraft account got hacked by someone name ElytraStar99,  still play a version of minecraft in a different way. Technoblade, thank you for being awesome. Technoblade never dies!",@Petey101-,Ugz-GXarQuUBXuKfeeN4AaABAg,0
